{
  "isGitCommit": false,
  "futurePrerequisiteEffect": "satisfies",
  "readbackHash": "8b08159dc48c60f97996c5938b46ed142d48853bb4bee3cf08b9c58fe826c051",
  "readbackStatus": "verified",
  "publicationTargetId": "fixture-store",
  "publicationLevel": 1,
  "evidence": [
    {
      "detail": "publication level 1 readback",
      "sha256": "b175ee5b2ae8ddf7f75e11dbf656897c7f545e5d9fcf9ef7f87f4abcbc052a3a",
      "source": "fixture-contract",
      "id": "knowledge-commit-level1"
    }
  ],
  "validatedFactIds": [
    "fact:aggregate"
  ],
  "resultIds": [
    "result:a:R",
    "result:b:R"
  ],
  "unitId": "unit:aggregate-1",
  "outputRevision": 3,
  "inputRevision": 2,
  "commitId": "c9bc16b46ffc7c6de55251b340653d9e17791bd5be84fd8e0b33439fdf0fdc0a",
  "schemaVersion": 1
}
